REF,NomTisane,NomLatin,Provenance,OrganeProducteur,Sb,Properties,Indications,ContreIndications,Note,Description
1,Achillée millefeuille,Achillea millefolium,Europe,Fleurs,Flavonoïdes;Lactones sesquiterpéniques;AlcaloÏdes;Achilléine;Triterpènes;Polyines;Coumarines;Acide salicylique;Camphre;Linalol;Sabinène;Proazulènes;Tanins,Antispasmodique;anti-inflammatoire;cholagogue;hémostatique;cicatrisante;apéritive;digestive,Crampes menstruelles;Crampes intestinales;Dysménorrhées;Aménorrhée;Troubles de la ménopause;Hémorroïdes;Régulation du cycle menstruel;Troubles digestifs,Allergies aux astéracées;Femmes enceintes; Femmes allaitantes;Jeunes enfants,"En infusion: 6 grammes pour 200ml d'eau frémissante. Laisser infuser 10 minutes. 3 à 4 tasse par jour.
En décoction (usage externe): 12 grammes pour 200ml d'eau. Faire bouillir 3 minutes, puis infuser 10 minutes. Laissez tiédire. Nettoyez vos plaies ou faites des compresses en cas d'hémorroïdes.","Découvrez les bienfaits de l’Achillée Millefeuille, une tisane européenne réputée pour ses propriétés antispasmodiques, anti-inflammatoires et digestives. Riche en flavonoïdes, lactones sesquiterpéniques et tanins, cette infusion est idéale pour soulager les crampes menstruelles, les troubles digestifs et réguler le cycle menstruel. Grâce à ses vertus cicatrisantes et hémostatiques, elle est également efficace contre les hémorroïdes. À consommer avec précaution si vous êtes allergique aux astéracées, enceinte, allaitante ou pour les jeunes enfants. Préparez une tasse en infusant 6 grammes de fleurs dans 200 ml d'eau frémissante pendant 10 minutes. Profitez de 3 à 4 tasses par jour pour un bien-être optimal.
"
2,Alchémille,Alchemilla vulgaris,Europe,Feuilles,Flavonoïdes;Tanins;Triterpènes;Acide salicylique,Astringente;Anti-inflammatoire;Cicatrisante,Troubles menstruels;aménorrhée;diarrhéedysenterie;gastro-entérite;plaies (voie externe),Femmes enceintes,"En infusion: 5-6 grammes pour 200ml d'eau frémissante. Laisser infuser 15 minutes. 3 à 4 tasse par jour en cas de diarrhées/gastro-entérite, ou en seconde partie de cycle (post-ovulation) en cas de troubles des règles.
","L’Alchémille, une plante européenne aux feuilles riches en flavonoïdes et tanins, est une tisane idéale pour apaiser les troubles menstruels et les affections digestives. Ses propriétés astringentes et anti-inflammatoires favorisent la cicatrisation des plaies et soulagent les gastro-entérites. Parfaite en période de déséquilibre hormonal ou en seconde partie de cycle menstruel, cette infusion naturelle est une alliée précieuse pour votre santé. À consommer en infusion avec 5 à 6 grammes de feuilles infusées dans 200 ml d'eau frémissante pendant 15 minutes, 3 à 4 tasses par jour selon vos besoins."
3,Aneth,Anethum graveolens,Méditerranée;Proche-Orient;,Graines,Carvone;Limonène,Digestive;Carminative;Diurétique;Anti-vomitive;Antispasmodique,Ballonnements;gaz;troubles digestifs;lactation; vomissement (enfants et adultes);hoquet,Grossesse,En infusion: 1 cuillère à café pour 200ml d'eau bouillante. Laisser infuser 10 minutes. 2 à 3 tasses par jour.,"Savourez la fraîcheur de l’Aneth, une tisane méditerranéenne réputée pour ses propriétés digestives et carminatives. Riche en carvone et limonène, elle soulage les ballonnements, les gaz et favorise une digestion harmonieuse. Idéale pour apaiser les vomissements chez les enfants et les adultes, cette infusion aide également à lutter contre le hoquet. Préparez une tasse en infusant une cuillère à café de graines dans 200 ml d'eau bouillante pendant 10 minutes. Consommez 2 à 3 tasses par jour pour une digestion sereine."
4,Angélique,Angelica archangelica,Europe,Racine,Coumarines;Terpènes;Résines;Bergaptène,Digestive;Apéritive;Antispasmodique;Apaisante,Digestion lente;ballonnements;vertiges;migraines;asthme nerveux;troubles des menstruations,Grossesse;allaitement;Photosensibilisante en raison des furocoumarines. Ne pas s'exposer au soleil lors d'un traitement à base d'Angélique,"En décoction: 6 grammes pour 200ml d'eau. Faire bouillir 3 minutes, puis infuser 10 minutes feu éteint. 1 tasse avant le repas pour ouvrir l'appétit ""apéritive"", ou en fin de repas pour faciliter la digestion.","L’Angélique, une tisane européenne aux racines puissantes, est reconnue pour ses vertus digestives et apéritives. Composée de coumarines et de terpènes, elle facilite la digestion lente, soulage les ballonnements et apaise les migraines. Parfaite avant le repas pour stimuler l’appétit ou après pour faciliter la digestion, cette infusion naturelle est également bénéfique contre les vertiges et l’asthme nerveux. À consommer en décoction en faisant bouillir 6 grammes de racine dans 200 ml d'eau pendant 3 minutes, puis infusez 10 minutes à feu éteint. Une tasse avant ou après les repas pour un confort digestif optimal."
5,Anis étoilée/Badiane,Illicium verum,Asie,Graines,Anéthole,Carminative;Digestive,Troubles digestifs;Ballonnements;Digestion lente;Eructations;Flatulences;Encombrement des voies respiratoires,"Grossesse;Allaitement;Enfants en bas âge;Cancers hormono-dépendants (déclarés, antécédents ou prédispostions)",En infusion: 1 cuillère à soupe pour 200ml d'eau. Laisser infuser 10 minutes.1 tasse après chaque repas.,"L’Anis Étoilé, également connu sous le nom de Badiane, est une tisane asiatique précieuse pour ses propriétés carminatives et digestives. Contenant de l’anéthole, cette infusion aide à soulager les troubles digestifs, les ballonnements et favorise une digestion rapide. Idéale après chaque repas pour prévenir les flatulences et améliorer la fonction respiratoire, elle est également efficace contre les vomissements. Préparez une tasse en infusant une cuillère à soupe de graines dans 200 ml d'eau bouillante pendant 10 minutes. Consommez une tasse après chaque repas pour une digestion harmonieuse."
6,Anis vert,Pimpinella anisum,Proche-Orient;Méditerranée,Graines,Anéthole;Méthylchavicol;Flavonoïdes;Stérols;Glucoside,Antispasmodique;Carminative;Digestive;Apaisante,Ballonnements;troubles digestifs;Spasmes de l'estomac;Spasmes intestinaux;Aérophagie;Vertiges;Spasmes utérins;Diarrhées;Flattulences;Ballonements;Asthme;Toux quinteuses;Favoriser la lactation;Migraine liée à la fatigue;Collique du nourrison et de l'enfant,Grossesse,"En infusion: 2 cuillères à café pour 200ml d'eau. Laisser infuser 10 minutes. 2 à 3 tasses par jour. Pour le dosage des enfants, demandez conseil à votre pharamacien.","L’Anis Vert est une tisane traditionnelle du Proche-Orient et de la Méditerranée, célèbre pour ses propriétés antispasmodiques et digestives. Riche en anéthole et en flavonoïdes, elle soulage les ballonnements, les spasmes intestinaux et favorise la lactation. Parfaite pour apaiser l’asthme, la toux et les migraines liées à la fatigue, cette infusion est également bénéfique pour les coliques du nourrisson. Préparez 2 cuillères à café de graines dans 200 ml d'eau chaude, laissez infuser 10 minutes et savourez 2 à 3 tasses par jour. Consultez votre pharmacien pour le dosage chez les enfants."
7,Artichaut,Cynara scolymus,Méditerranée,Feuilles,Cynarine;Acides phénoliques;Flavonoïdes;Lactones sesquiterpéniques,Hépatoprotectrice;Cholérétique;Cholagogue;Diurétique;Digestive;Apéritive,Troubles hépatiques;Ictère;Lithiase biliaire;Intoxication intestinale;Diabète d'origine hépatique;Digestion lente;Certains cas de dermatoses;Obésité;Excès de cholestérol;Goutte;Rhumatismes,Occlusion biliaire;Calculs biliaires;Consultez votre médécin,"En infusion: 6 grammes de feuilles pour 200 ml d'eau bouillante. Prendre un bol avant chaque repas. 
Certes très amère, elle se révèle incontournable pour la santé du foie et de la digestion en général!","Découvrez les bienfaits de la tisane d’Artichaut, une infusion méditerranéenne aux feuilles riches en cynarine et flavonoïdes. Réputée pour ses propriétés hépatoprotectrices, cholagogues et digestives, elle est idéale pour soutenir la santé du foie, favoriser la digestion et réduire le cholestérol. Parfaite pour les personnes souffrant de troubles hépatiques, d’obésité ou de goutte, cette tisane amère mais essentielle se prépare en infusant 6 grammes de feuilles dans 200 ml d'eau bouillante avant chaque repas. Intégrez-la à votre routine quotidienne pour une digestion optimisée et un foie en pleine santé."
8,Aubépine,Crataegus laevigata,Europe,Fleurs;Feuilles,Flavonoïdes;Acides triterpéniques;Acides-phénols;Proanthocyanidines;Hétérosides cyanogénétiques;Tanins,Cardiotonique;Antispasmodique;Sédative,Hypertension;Hypotensions;Anxiété;Palpitations;Arythmie;Troubles de la ménopause;Bouffées de chaleur;Insomnie;irritabilité;Bourdonnement d'oreilles;,Grossesse,"En infusion: 4 grammes de fleurs pour 200ml d'eau frémissante. Laisser infuser 10 minutes. 3 à 4 tasses par jour. Cure de 20 jours par mois.
Il faut du temps pour ressentir les effets de l'aubépine, en revanche, ces bénéfices se poursuivent longtemps après la prise.","L’Aubépine est une tisane européenne précieuse pour ses effets cardiotoniques et sédatifs. Riche en flavonoïdes et en proanthocyanidines, elle aide à réguler la tension artérielle, soulager l’anxiété et les palpitations. Idéale pour les personnes souffrant d’hypertension, d’arythmie ou de troubles de la ménopause, cette infusion apaise également l’insomnie et l’irritabilité. Préparez une tasse en infusant 4 grammes de plante dans 200 ml d'eau frémissante pendant 10 minutes et consommez 3 à 4 tasses par jour, en cure de 20 jours par mois. Patientez pour ressentir pleinement les bienfaits durables de l’Aubépine."
9,Bardane,Arctium lappa,Europe;Asie,Racine;Feuilles,Inuline;Acides phénoliques;Flavonoïdes;Tanins,Dépurative;Diurétique;Sudorifique;Myorelaxante;Antioxydante;Anti-infectieuse;Hypoglécimiante,Acné;Eczéma;Problèmes de peau;Staphylocoques;Furonculose;Goutte;Rhumatismes;Diabète;Insuffisance pancréatique;Contracture musculaire;Infection urinaire,"Femmes enceintes et allaitantes
Personnes souffrant de calculs urinaires/Colique néphrétique.
Allergies aux astéracées","Utilisez des racines fraîches, si possible, les racines séchées ne contiennent que très peu de principes actifs.
En décoction (usage interne): 12 grammes de racines coupées pour 200ml d'eau. Bouillir 5 minutes et laisser infuser 10 minutes feu étaint. 4 tasses par jours. Ne pas conserver plus d'une journée. 
La couleur vert pomme est normale.
En décoction concentrée (usage externe): 200 grammes de racines fraïches pour 1 litre d'eau. Faire bouillir 10 minutes et laisser infuser 10 minutes feu éteint. Nettoyer la peau du visage, du haut du dos et du torse en cas d'acné.
","La Bardane est une tisane purifiante européenne et asiatique, reconnue pour ses propriétés dépuratives et diurétiques. Riche en inuline et en flavonoïdes, elle aide à traiter l’acné, l’eczéma, les rhumatismes et le diabète d’origine hépatique. Parfaite pour détoxifier le corps et renforcer le système immunitaire, cette infusion nécessite des racines fraîches pour une efficacité optimale. Préparez une décoction en faisant bouillir 12 grammes de racines coupées dans 200 ml d'eau pendant 5 minutes, puis laissez infuser 10 minutes. Consommez 4 tasses par jour pour bénéficier de ses vertus purifiantes. Pour un usage externe, utilisez une décoction concentrée pour nettoyer la peau et traiter l’acné."
10,Bleuet,Centaurea cyanus,Europe,Fleurs,Anthocyanines;Flavonoïdes;Polyines;Tanins,Anti-inflammatoire;Astringente,Irritations oculaires;Conjonctivite,Aucune connue,En infusion (usage externe): 2 cuillère à café de fleurs pour 200 ml d'eau frémissante. Laisser tièdir. Puis faites des compresses trempées à déposer sur les yeux.,"Le Bleuet est une tisane européenne aux fleurs bleues, idéale pour ses propriétés anti-inflammatoires et astringentes. Riche en anthocyanines et en tanins, elle est particulièrement efficace pour soulager les irritations oculaires et la conjonctivite. Simple à préparer, il suffit d’infuser 2 cuillères à café de fleurs dans 200 ml d'eau frémissante, de laisser tiédir, puis d'appliquer des compresses sur les yeux pour apaiser et réduire les inflammations. Intégrez le Bleuet à votre routine pour des yeux reposés et protégés naturellement."
11,Bouleau,Betula alba,Europe,Feuilles;Bourgeons;Ecorce;Sève,Flavonoïdes;Rutoside;Acides-phénol;Triterpènes;Tanins; Acide bétulinique (écorce),Diurétique;Dépurative;Drainant des ganglions lymphatiques (bourgeons);Digestif (écorce);Fébrifuge (écorce),Rétention d'eau;Problèmes urinaires;Calculs rénaux;Maladies de peau (dartres),Insuffisance rénale,"En infusion: 5 grammes de feuilles pour 200ml d'eau bouillante. Laisser infuser 10 à 15 minutes. 3 tasses par jour.
En décoction: 1 cuillère à café d'écorce pour 200ml d'eau. Laisser bouillir 5 minutes, puis infuser 10 minutes feu éteint. 3 tasses par jour avant les repas.","Découvrez les bienfaits du Bouleau, une tisane européenne réputée pour ses propriétés diurétiques, dépuratives et digestives. Riche en flavonoïdes, rutoside, acides phénoliques, triterpènes et tanins, cette infusion aide à éliminer la rétention d'eau, soulager les problèmes urinaires et prévenir les calculs rénaux. Les bourgeons agissent comme drainants des ganglions lymphatiques, tandis que l'écorce possède des vertus digestives et fébrifuges. À consommer avec précaution en cas d'insuffisance rénale. Préparez une infusion en laissant infuser 5 grammes de feuilles dans 200 ml d'eau bouillante pendant 10 à 15 minutes et buvez 3 tasses par jour. Pour la décoction, utilisez une cuillère à café d'écorce pour 200 ml d'eau, faites bouillir 5 minutes, puis laissez infuser 10 minutes à feu éteint avant les repas."
12,Bourrache,Borago officinalis,Bassin méditerranéen,Fleurs;Feuilles;Tiges,Tanins;Nitrate de potassium (feuilles et tiges);Alacloïdes pyrrolizidiniques;Mucilage (fleurs),Anti-inflammatoire;Diurétique;Sudorifique;Emoliente;Dépuratif,Rétention d'eau;Inflammation;Troubles respiratoires,,"En infusion: 4 à 8 grammes de fleurs ou de sommités fleuries (fleurs, feuilles, tiges) pour 200ml d'eau frémissante. Laisser infuser 10 minutes. 3 à 4 tasses par jour.

En salade: Vous pouvez ajouter quelques fleurs de bourrache dans vos salades pour leur apporter un délicieux goût supplémentaire.","La Bourrache, originaire du bassin méditerranéen, est une tisane aux multiples vertus anti-inflammatoires, diurétiques et dépuratives. Composée de tanins, nitrate de potassium, alcaloïdes pyrrolizidiniques et mucilage, elle est idéale pour traiter la rétention d'eau, les inflammations et les troubles respiratoires. Parfaite pour apaiser les inflammations internes et externes, elle peut également être consommée en salade pour son délicieux goût. Préparez une infusion en utilisant 4 à 8 grammes de fleurs ou de sommités fleuries dans 200 ml d'eau frémissante, laisser infuser pendant 10 minutes et consommez 3 à 4 tasses par jour. Pour une touche gourmande, ajoutez quelques fleurs de bourrache à vos salades."
13,Busserole,Arctostaphylos uva-ursi,Europe;Asie;Amérique du Nord;Amérique centrale,Feuilles,Hétérosides phénoliques;Arbutoside;Tanins;Flavonoïdes;Triterpènes;Iridoïde,Antiseptique urinaire;Diurétique;Astringent,Infections urinaires;Troubles rénaux;Diarrhées;Leucorrhée (pertes vaginales),Grossesse;Allaitement;Enfants de moins de 12 ans;Insuffisance rénale;Ulcère;Prise d'anti-inflammatoires;Prise de vitamine C;Constipation chronique;Ne pas porlonger le traitement au-delà de 2 semaines et pas plus de 5 fois par an.,"En décoction: 10 grammes de feuilles pour 1/2 litre d'eau. Faire bouillir 3 minutes, puis infuser 10 minutes feu éteint. 3 bols par jour pendant 10 jour en cas d'infection urinaire.
En cas de nausées, réduisez le grammage par litre.","La Busserole est une tisane puissante utilisée principalement pour ses propriétés antiseptiques urinaires et diurétiques. Riche en hétérosides phénoliques, arbutoside, tanins et flavonoïdes, elle est efficace contre les infections urinaires, les troubles rénaux et les leucorrhées. À consommer avec prudence durant la grossesse, l'allaitement et en cas d'insuffisance rénale. Préparez une décoction en faisant bouillir 10 grammes de feuilles dans un demi-litre d'eau pendant 3 minutes, puis laissez infuser 10 minutes à feu éteint. Consommez 3 bols par jour pendant 10 jours en cas d'infection urinaire. En cas de nausées, réduisez la quantité par litre d'eau."
14,Calendula/Souci,Calendula officinalis,Europe,Fleurs,Flavonoïdes;Caroténoïdes;Triterpènes;Xanthophylles;Mucilage;Phytostérols;Saponosides,Anti-inflammatoire;Antibactérienne;Cicatrisant;Anti-infectieux;Anti-fongique;Emménagogue;Légèrement oestrogen-like;,Problèmes de peau;Plaies;Acné;Eczéma;Psoriasis;Cors;Verrues;Favorise l'apparition des règles;Règles douloureuses;Inflammation digestive;Brûlures d'estomac,Allergies à la famille des astéracées,"En infusion: 6 grammes de fleurs pour 200 ml d'eau frémissante. Laisser infuser 10 minutes. 3 à 4 tasse par jours. Pour provoquer ou régulariser le cycle menstruel, suivre ce traitement pendant les 10 à 15 jours avant la date présumée des règles.
En décoction (usage externe): 50 grammes de fleurs pour 1/2 litre d'eau. Faire bouillir 2 minutes, puis infuser 10 minutes feu éteint. Idéale en gargarisme (aphtes, gengivites, stomatites), en bain de pieds, en compresse pour les affections de la peau.","Le Calendula, ou Souci, est une tisane européenne reconnue pour ses propriétés anti-inflammatoires, antibactériennes et cicatrisantes. Riche en flavonoïdes, caroténoïdes, triterpènes et mucilages, elle est idéale pour traiter les problèmes de peau tels que l'acné, l'eczéma, et les brûlures d'estomac. Parfaite pour favoriser l'apparition des règles et soulager les douleurs menstruelles. À consommer avec précaution en cas d'allergies aux astéracées. Préparez une infusion en laissant infuser 6 grammes de fleurs dans 200 ml d'eau frémissante pendant 10 minutes et buvez 3 à 4 tasses par jour. Pour un usage externe, préparez une décoction avec 50 grammes de fleurs dans un demi-litre d'eau bouillante pendant 2 minutes, puis laissez infuser 10 minutes feu éteint. Idéale pour les gargarismes, bains de pieds ou compresses pour la peau."
15,Camomille allemande/matricaire,Matricaria chamomilla/Chamomilla recutita,Europe;Asie;Afrique du Nord,Fleurs,Chamazulène;Alpha-bisabolol;Flavonoïdes;Apigénine;Lactones sesquiterpéniques;Coumarines;Mucilages,Antispasmodique;Calmante;Anti-inflammatoire;Apéritive;Digestive;Calmante,Troubles digestifs;Insomnie;Anxiété;Manque d'appétit;Acidité gastrique;Affections cutanées;Irriattions des muqueuses.Cheveux blonds,Allergies à la famille des astéracées,"En infusion: 5 grammes de fleurs pour 200ml d'eau frémissante. Laisser infuser 10 minutes. 3 à 4 tasses par jours.
En décoction (usage externe): 50 grammes de fleurs pour 1 litre d'eau. Faire bouillir 20 minutes. Laisser tiédir. A utliser comme dernière eau de rinçage pour les cheveux blonds ou en compresse sur les yeux ou la peau affectés.","La Camomille Allemande, également connue sous le nom de Matricaire, est une tisane appréciée pour ses propriétés antispasmodiques, calmantes et anti-inflammatoires. Composée de chamazulène, alpha-bisabolol, flavonoïdes et mucilages, elle est parfaite pour soulager les troubles digestifs, l'insomnie, l'anxiété et les affections cutanées. À consommer avec précaution en cas d'allergies aux astéracées. Préparez une infusion en laissant infuser 5 grammes de fleurs dans 200 ml d'eau frémissante pendant 10 minutes et buvez 3 à 4 tasses par jour. Pour un usage externe, préparez une décoction avec 50 grammes de fleurs dans un litre d'eau bouillante pendant 20 minutes, laissez tiédir et utilisez comme dernière eau de rinçage pour les cheveux blonds ou en compresses pour les yeux et la peau."
16,Cardamome,Elettaria cardamomum,Inde,Graines,Camphre;Bornéol;Pinène;Carvone,Digestive;Carminative;Stimulante,Maux d'estomac;Flatulences;Coliques,Grossesse;Maladies cardiaques;Maladies hépatiques,En infusion: 5 grammes de graines pour 200ml d'eau bouillante. Laisser infuser 10 minutes. 1 tasse après chaque repas.,"La Cardamome est une tisane indienne aux propriétés digestives, carminatives et stimulantes. Riche en camphre, bornéol, pinène et carvone, elle est idéale pour soulager les maux d'estomac, les flatulences et les coliques. À éviter durant la grossesse et en cas de maladies cardiaques ou hépatiques. Préparez une infusion en laissant infuser 5 grammes de graines dans 200 ml d'eau bouillante pendant 10 minutes et buvez une tasse après chaque repas pour une digestion optimale."
17,Cassis,Ribes nigrum,Europe,Feuilles,Flavonoïdes;Tanins,Anti-inflammatoire;Antioxydante;Diurétique;Antirhumatismal;Stimulant du système nerveux sympathique;Hypotenseur,Arthrite;insuffisance veineuse;Goutte;Rhumatismes;Artériosclérose;Tension artérielle;Stress;Allergies;Maux de gorge (gargarisme);Aphtes (gargarisme),Grossesse;Allaitement;Enfants de moins de 18 ans;Insuffisance cardiaque;Insuffisance rénale,"En infusion: 5 grammes de feuilles pour 200ml d'eau bouillante. Laisser infuser 10 minutes. 3 tasses par jour entre les repas. 
Usage externe: Contre les piqûre de guêpe, frelon. Froisser des feuilles de cassis pour en faire sortir le suc sur l'endroit de la piqûre pour atténuer les effets en attendant le médecin ou d'aller aux urgences en cas de surréaction.
En cas de doute il faut absolument consulter au plus vite.
","Le Cassis est une tisane européenne réputée pour ses propriétés anti-inflammatoires, antioxydantes et diurétiques. Riche en flavonoïdes et tanins, elle est particulièrement efficace contre l'arthrite, l'insuffisance veineuse, la goutte, les rhumatismes et le stress. À consommer avec précaution durant la grossesse, l'allaitement et chez les enfants de moins de 18 ans. Préparez une infusion en laissant infuser 5 grammes de feuilles dans 200 ml d'eau bouillante pendant 10 minutes et buvez 3 tasses par jour entre les repas. En usage externe, les feuilles écrasées peuvent être appliquées sur les piqûres d'insectes pour atténuer les effets en attendant une prise en charge médicale.
"
18,Chardon-Marie,Silybum marianum,Méditerranée,Graines,Silymarine;Flavonoïdes;Tyramine,Hépatoprotectrice;Cholagogue;Décongestionnant hépatique;Régénérante cellulaire du foie,Protection du foie;Désintoxication;Détoxification,"Allergies aux asteracées;Obstruction des voies biliaires;Interractions médicamenteuses, en cas de traitement, demandez conseil à votre pharmacien avant toute prise;Grossesse;Allaitement;Enfant de moins de 18 ans",,"Le Chardon-Marie est une tisane méditerranéenne célèbre pour ses vertus hépatoprotectrices et régénératrices du foie. Riche en silymarine, flavonoïdes et tyramine, elle aide à la protection du foie, la désintoxication et la détoxification. À consommer avec précaution en cas d'allergies aux astéracées, obstruction des voies biliaires ou durant la grossesse et l'allaitement. Consultez votre pharmacien en cas de traitement médicamenteux. Préparez une infusion en utilisant les graines selon les recommandations spécifiques pour bénéficier de ses bienfaits pour le foie."
19,Chicorée,Cichorium intybus,Hémisphère Nord,Racines;Feuilles,Inuline (racines);Lactones sesquiterpéniques,Digestive;Dépurative;Cholérétique;Cholagogue;Diurétique;Stomachique;Tonique hépatiques;Antirhumatismale,Troubles digestifs;Santé du foie;Rhumatismes;Goutte;Soif liée au diabète;Elimination urinaire chez les diabétiques.,Calculs biliaires;Insiffusance rénale,"En infusion: 3 grammes de feuilles séchées pour 200ml d'eau bouillante. Laisser infuser 10 minutes. 2 à 3 tasses par jour avant les repas.
En décoction: 10 grammes de racines séches pour 1/2 litre d'eau. Faire bouillir 3 minutes et laisser infuser 10 minutes feu éteint. 2 à 3 tasse par jour avant les repas.
En salade de jeunes pousses de chicorée. Donne de l'appétit (apéritive), diurétique et déconstipante. Et excellente avec sa petite amertume!","La Chicorée est une tisane polyvalente utilisée pour ses propriétés digestives, dépuratives et cholérétiques. Riche en inuline et lactones sesquiterpéniques, elle favorise la santé du foie, soulage les troubles digestifs et aide à l'élimination urinaire, particulièrement chez les diabétiques. À consommer avec précaution en cas de calculs biliaires ou d'insuffisance rénale. Préparez une infusion en laissant infuser 3 grammes de feuilles séchées dans 200 ml d'eau bouillante pendant 10 minutes et buvez 2 à 3 tasses par jour avant les repas. Pour une décoction, utilisez 10 grammes de racines sèches dans un demi-litre d'eau bouillante pendant 3 minutes, puis laissez infuser 10 minutes à feu éteint. Ajoutez les jeunes pousses de chicorée à vos salades pour un goût légèrement amer et des bienfaits digestifs."
