REF,NomTisane,NomLatin,Provenance,OrganeProducteur,Sb,Properties,Indications,ContreIndications,Note,Description
60,Reine des prés,Filipendula ulmaria,Europe,Fleurs,Salicylates;flavonoïdes;tanins,Anti-inflammatoire;diurétique,Douleurs articulaires;fièvre,Allergie aux salicylates,,"La tisane de Reine des prés (Filipendula ulmaria) est originaire de Europe. 
    Elle est issue des Fleurs et contient des composants tels que Salicylates;flavonoïdes;tanins. 
    Ces composants sont reconnus pour leurs effets bénéfiques, notamment pour leurs propriétés Anti-inflammatoire, diurétique. 
    Utilisée principalement pour traiter Douleurs articulaires, fièvre, cette tisane est particulièrement prisée dans les remèdes naturels.

    La tisane de Reine des prés est idéale pour Douleurs articulaires, fièvre, offrant une solution naturelle et efficace pour améliorer la santé et le bien-être. 
    
    Précautions d'utilisation : Allergie aux salicylates.
    
    En résumé, la tisane de Reine des prés est idéale pour Douleurs articulaires, fièvre grâce à ses multiples bienfaits et constitue un ingrédient incontournable pour ceux qui recherchent des solutions naturelles."
61,Reishi,Ganoderma lucidum,Asie,Champignon,Polysaccharides;triterpènes;stérols,Immunomodulatrice;anti-inflammatoire,Renforcement du système immunitaire;fatigue,Aucune connue,,"La tisane de Reishi (Ganoderma lucidum) est originaire de Asie. 
    Elle est issue des Champignon et contient des composants tels que Polysaccharides;triterpènes;stérols. 
    Ces composants sont reconnus pour leurs effets bénéfiques, notamment pour leurs propriétés Immunomodulatrice, anti-inflammatoire. 
    Utilisée principalement pour traiter Renforcement du système immunitaire, fatigue, cette tisane est particulièrement prisée dans les remèdes naturels.

    La tisane de Reishi est idéale pour Renforcement du système immunitaire, fatigue, offrant une solution naturelle et efficace pour améliorer la santé et le bien-être. 
    
    Précautions d'utilisation : Aucune connue.
    
    En résumé, la tisane de Reishi est idéale pour Renforcement du système immunitaire, fatigue grâce à ses multiples bienfaits et constitue un ingrédient incontournable pour ceux qui recherchent des solutions naturelles."
62,Romarin,Rosmarinus officinalis,Méditerranée,Feuilles,Acide rosmarinique;camphre;carnosol,Tonique;cognitive;digestive,Fatigue mentale;troubles digestifs,Hypertension,,"La tisane de Romarin (Rosmarinus officinalis) est originaire de Méditerranée. 
    Elle est issue des Feuilles et contient des composants tels que Acide rosmarinique;camphre;carnosol. 
    Ces composants sont reconnus pour leurs effets bénéfiques, notamment pour leurs propriétés Tonique, cognitive, digestive. 
    Utilisée principalement pour traiter Fatigue mentale, troubles digestifs, cette tisane est particulièrement prisée dans les remèdes naturels.

    La tisane de Romarin est idéale pour Fatigue mentale, troubles digestifs, offrant une solution naturelle et efficace pour améliorer la santé et le bien-être. 
    
    Précautions d'utilisation : Hypertension.
    
    En résumé, la tisane de Romarin est idéale pour Fatigue mentale, troubles digestifs grâce à ses multiples bienfaits et constitue un ingrédient incontournable pour ceux qui recherchent des solutions naturelles."
63,Sarrasin,Fagopyrum esculentum,Europe,Graines,Rutine;flavonoïdes;protéines,Antioxydante;digestive,Troubles digestifs;insuffisance veineuse,Aucune connue,,"La tisane de Sarrasin (Fagopyrum esculentum) est originaire de Europe. 
    Elle est issue des Graines et contient des composants tels que Rutine;flavonoïdes;protéines. 
    Ces composants sont reconnus pour leurs effets bénéfiques, notamment pour leurs propriétés Antioxydante, digestive. 
    Utilisée principalement pour traiter Troubles digestifs, insuffisance veineuse, cette tisane est particulièrement prisée dans les remèdes naturels.

    La tisane de Sarrasin est idéale pour Troubles digestifs, insuffisance veineuse, offrant une solution naturelle et efficace pour améliorer la santé et le bien-être. 
    
    Précautions d'utilisation : Aucune connue.
    
    En résumé, la tisane de Sarrasin est idéale pour Troubles digestifs, insuffisance veineuse grâce à ses multiples bienfaits et constitue un ingrédient incontournable pour ceux qui recherchent des solutions naturelles."
65,Sauge,Salvia officinalis,Méditerranée,Feuilles,Thujone;camphre;acides phénoliques,Antiseptique;tonique,Bouffées de chaleur;maux de gorge,Grossesse;allaitement,,"La tisane de Sauge (Salvia officinalis) est originaire de Méditerranée. 
    Elle est issue des Feuilles et contient des composants tels que Thujone;camphre;acides phénoliques. 
    Ces composants sont reconnus pour leurs effets bénéfiques, notamment pour leurs propriétés Antiseptique, tonique. 
    Utilisée principalement pour traiter Bouffées de chaleur, maux de gorge, cette tisane est particulièrement prisée dans les remèdes naturels.

    La tisane de Sauge est idéale pour Bouffées de chaleur, maux de gorge, offrant une solution naturelle et efficace pour améliorer la santé et le bien-être. 
    
    Précautions d'utilisation : Grossesse;allaitement.
    
    En résumé, la tisane de Sauge est idéale pour Bouffées de chaleur, maux de gorge grâce à ses multiples bienfaits et constitue un ingrédient incontournable pour ceux qui recherchent des solutions naturelles."
66,Serpolet,Thymus serpyllum,Europe,Feuilles,Thymol;carvacrol;flavonoïdes,Antibactérienne;digestive,Infections respiratoires;toux,Aucune connue,,"La tisane de Serpolet (Thymus serpyllum) est originaire de Europe. 
    Elle est issue des Feuilles et contient des composants tels que Thymol;carvacrol;flavonoïdes. 
    Ces composants sont reconnus pour leurs effets bénéfiques, notamment pour leurs propriétés Antibactérienne, digestive. 
    Utilisée principalement pour traiter Infections respiratoires, toux, cette tisane est particulièrement prisée dans les remèdes naturels.

    La tisane de Serpolet est idéale pour Infections respiratoires, toux, offrant une solution naturelle et efficace pour améliorer la santé et le bien-être. 
    
    Précautions d'utilisation : Aucune connue.
    
    En résumé, la tisane de Serpolet est idéale pour Infections respiratoires, toux grâce à ses multiples bienfaits et constitue un ingrédient incontournable pour ceux qui recherchent des solutions naturelles."
67,Thé noir,Camellia sinensis,Asie,Feuilles,Théine;catéchines;flavonoïdes,Stimulante;antioxydante,Fatigue;digestion difficile,Insomnie;hypertension,,"La tisane de Thé noir (Camellia sinensis) est originaire de Asie. 
    Elle est issue des Feuilles et contient des composants tels que Théine;catéchines;flavonoïdes. 
    Ces composants sont reconnus pour leurs effets bénéfiques, notamment pour leurs propriétés Stimulante, antioxydante. 
    Utilisée principalement pour traiter Fatigue, digestion difficile, cette tisane est particulièrement prisée dans les remèdes naturels.

    La tisane de Thé noir est idéale pour Fatigue, digestion difficile, offrant une solution naturelle et efficace pour améliorer la santé et le bien-être. 
    
    Précautions d'utilisation : Insomnie;hypertension.
    
    En résumé, la tisane de Thé noir est idéale pour Fatigue, digestion difficile grâce à ses multiples bienfaits et constitue un ingrédient incontournable pour ceux qui recherchent des solutions naturelles."
68,Thé rooibos,Aspalathus linearis,Afrique du Sud,Feuilles,Flavonoïdes;antioxydants;minéraux,Antioxydante;digestive,Troubles digestifs;fatigue,Aucune connue,,"La tisane de Thé rooibos (Aspalathus linearis) est originaire de Afrique du Sud. 
    Elle est issue des Feuilles et contient des composants tels que Flavonoïdes;antioxydants;minéraux. 
    Ces composants sont reconnus pour leurs effets bénéfiques, notamment pour leurs propriétés Antioxydante, digestive. 
    Utilisée principalement pour traiter Troubles digestifs, fatigue, cette tisane est particulièrement prisée dans les remèdes naturels.

    La tisane de Thé rooibos est idéale pour Troubles digestifs, fatigue, offrant une solution naturelle et efficace pour améliorer la santé et le bien-être. 
    
    Précautions d'utilisation : Aucune connue.
    
    En résumé, la tisane de Thé rooibos est idéale pour Troubles digestifs, fatigue grâce à ses multiples bienfaits et constitue un ingrédient incontournable pour ceux qui recherchent des solutions naturelles."
69,Thé vert,Camellia sinensis,Asie,Feuilles,Catéchines;flavonoïdes;caféine,Antioxydante;stimulante,Fatigue;troubles métaboliques,Insomnie;grossesse,,"La tisane de Thé vert (Camellia sinensis) est originaire de Asie. 
    Elle est issue des Feuilles et contient des composants tels que Catéchines;flavonoïdes;caféine. 
    Ces composants sont reconnus pour leurs effets bénéfiques, notamment pour leurs propriétés Antioxydante, stimulante. 
    Utilisée principalement pour traiter Fatigue, troubles métaboliques, cette tisane est particulièrement prisée dans les remèdes naturels.

    La tisane de Thé vert est idéale pour Fatigue, troubles métaboliques, offrant une solution naturelle et efficace pour améliorer la santé et le bien-être. 
    
    Précautions d'utilisation : Insomnie;grossesse.
    
    En résumé, la tisane de Thé vert est idéale pour Fatigue, troubles métaboliques grâce à ses multiples bienfaits et constitue un ingrédient incontournable pour ceux qui recherchent des solutions naturelles."
70,Thym,Thymus vulgaris,Méditerranée,Feuilles,Thymol;carvacrol;flavonoïdes,Antibactérienne;expectorante,Infections respiratoires;toux,Grossesse;enfants en bas âge,,"La tisane de Thym (Thymus vulgaris) est originaire de Méditerranée. 
    Elle est issue des Feuilles et contient des composants tels que Thymol;carvacrol;flavonoïdes. 
    Ces composants sont reconnus pour leurs effets bénéfiques, notamment pour leurs propriétés Antibactérienne, expectorante. 
    Utilisée principalement pour traiter Infections respiratoires, toux, cette tisane est particulièrement prisée dans les remèdes naturels.

    La tisane de Thym est idéale pour Infections respiratoires, toux, offrant une solution naturelle et efficace pour améliorer la santé et le bien-être. 
    
    Précautions d'utilisation : Grossesse;enfants en bas âge.
    
    En résumé, la tisane de Thym est idéale pour Infections respiratoires, toux grâce à ses multiples bienfaits et constitue un ingrédient incontournable pour ceux qui recherchent des solutions naturelles."
71,Thym citron,Thymus citriodorus,Méditerranée,Feuilles,Thymol;citral;flavonoïdes,Antiseptique;digestive,Infections respiratoires;digestion lente,Grossesse,,"La tisane de Thym citron (Thymus citriodorus) est originaire de Méditerranée. 
    Elle est issue des Feuilles et contient des composants tels que Thymol;citral;flavonoïdes. 
    Ces composants sont reconnus pour leurs effets bénéfiques, notamment pour leurs propriétés Antiseptique, digestive. 
    Utilisée principalement pour traiter Infections respiratoires, digestion lente, cette tisane est particulièrement prisée dans les remèdes naturels.

    La tisane de Thym citron est idéale pour Infections respiratoires, digestion lente, offrant une solution naturelle et efficace pour améliorer la santé et le bien-être. 
    
    Précautions d'utilisation : Grossesse.
    
    En résumé, la tisane de Thym citron est idéale pour Infections respiratoires, digestion lente grâce à ses multiples bienfaits et constitue un ingrédient incontournable pour ceux qui recherchent des solutions naturelles."
72,Tilleul,Tilia cordata,Europe,Fleurs,Flavonoïdes;mucilages;tanins,Sédative;calmante,Insomnie;stress;anxiété,Hypotension,,"La tisane de Tilleul (Tilia cordata) est originaire de Europe. 
    Elle est issue des Fleurs et contient des composants tels que Flavonoïdes;mucilages;tanins. 
    Ces composants sont reconnus pour leurs effets bénéfiques, notamment pour leurs propriétés Sédative, calmante. 
    Utilisée principalement pour traiter Insomnie, stress, anxiété, cette tisane est particulièrement prisée dans les remèdes naturels.

    La tisane de Tilleul est idéale pour Insomnie, stress, anxiété, offrant une solution naturelle et efficace pour améliorer la santé et le bien-être. 
    
    Précautions d'utilisation : Hypotension.
    
    En résumé, la tisane de Tilleul est idéale pour Insomnie, stress, anxiété grâce à ses multiples bienfaits et constitue un ingrédient incontournable pour ceux qui recherchent des solutions naturelles."
73,Tournesol,Helianthus annuus,Europe,Fleurs;Graines,Flavonoïdes;acides phénoliques;vitamines,Anti-inflammatoire;antioxydante,Fatigue;troubles digestifs,Aucune connue,,"La tisane de Tournesol (Helianthus annuus) est originaire de Europe. 
    Elle est issue des Fleurs;Graines et contient des composants tels que Flavonoïdes;acides phénoliques;vitamines. 
    Ces composants sont reconnus pour leurs effets bénéfiques, notamment pour leurs propriétés Anti-inflammatoire, antioxydante. 
    Utilisée principalement pour traiter Fatigue, troubles digestifs, cette tisane est particulièrement prisée dans les remèdes naturels.

    La tisane de Tournesol est idéale pour Fatigue, troubles digestifs, offrant une solution naturelle et efficace pour améliorer la santé et le bien-être. 
    
    Précautions d'utilisation : Aucune connue.
    
    En résumé, la tisane de Tournesol est idéale pour Fatigue, troubles digestifs grâce à ses multiples bienfaits et constitue un ingrédient incontournable pour ceux qui recherchent des solutions naturelles."
74,Trèfle rouge,Trifolium pratense,Europe,Fleurs,Isoflavones;flavonoïdes;tanins,Phytoestrogénique;anti-inflammatoire,Bouffées de chaleur;rhumatismes,Grossesse,,"La tisane de Trèfle rouge (Trifolium pratense) est originaire de Europe. 
    Elle est issue des Fleurs et contient des composants tels que Isoflavones;flavonoïdes;tanins. 
    Ces composants sont reconnus pour leurs effets bénéfiques, notamment pour leurs propriétés Phytoestrogénique, anti-inflammatoire. 
    Utilisée principalement pour traiter Bouffées de chaleur, rhumatismes, cette tisane est particulièrement prisée dans les remèdes naturels.

    La tisane de Trèfle rouge est idéale pour Bouffées de chaleur, rhumatismes, offrant une solution naturelle et efficace pour améliorer la santé et le bien-être. 
    
    Précautions d'utilisation : Grossesse.
    
    En résumé, la tisane de Trèfle rouge est idéale pour Bouffées de chaleur, rhumatismes grâce à ses multiples bienfaits et constitue un ingrédient incontournable pour ceux qui recherchent des solutions naturelles."
75,Valériane,Valeriana officinalis,Europe;Asie,Racine,Valépotriates;acides sesquiterpéniques;flavonoïdes,Sédative;anxiolytique,Insomnie;nervosité;anxiété,Grossesse;allaitement,,"La tisane de Valériane (Valeriana officinalis) est originaire de Europe;Asie. 
    Elle est issue des Racine et contient des composants tels que Valépotriates;acides sesquiterpéniques;flavonoïdes. 
    Ces composants sont reconnus pour leurs effets bénéfiques, notamment pour leurs propriétés Sédative, anxiolytique. 
    Utilisée principalement pour traiter Insomnie, nervosité, anxiété, cette tisane est particulièrement prisée dans les remèdes naturels.

    La tisane de Valériane est idéale pour Insomnie, nervosité, anxiété, offrant une solution naturelle et efficace pour améliorer la santé et le bien-être. 
    
    Précautions d'utilisation : Grossesse;allaitement.
    
    En résumé, la tisane de Valériane est idéale pour Insomnie, nervosité, anxiété grâce à ses multiples bienfaits et constitue un ingrédient incontournable pour ceux qui recherchent des solutions naturelles."
76,Verveine,Aloysia citrodora,Amérique du Sud,Feuilles,Citral;géraniol;limonène,Digestive;calmante,Digestion difficile;stress;insomnie,Aucune connue,,"La tisane de Verveine (Aloysia citrodora) est originaire de Amérique du Sud. 
    Elle est issue des Feuilles et contient des composants tels que Citral;géraniol;limonène. 
    Ces composants sont reconnus pour leurs effets bénéfiques, notamment pour leurs propriétés Digestive, calmante. 
    Utilisée principalement pour traiter Digestion difficile, stress, insomnie, cette tisane est particulièrement prisée dans les remèdes naturels.

    La tisane de Verveine est idéale pour Digestion difficile, stress, insomnie, offrant une solution naturelle et efficace pour améliorer la santé et le bien-être. 
    
    Précautions d'utilisation : Aucune connue.
    
    En résumé, la tisane de Verveine est idéale pour Digestion difficile, stress, insomnie grâce à ses multiples bienfaits et constitue un ingrédient incontournable pour ceux qui recherchent des solutions naturelles."
77,Verveine citronnelle,Aloysia citrodora,Amérique du Sud,Feuilles,Citral;limonène;flavonoïdes,Digestive;calmante,Digestion lente;stress;insomnie,Grossesse,,"La tisane de Verveine citronnelle (Aloysia citrodora) est originaire de Amérique du Sud. 
    Elle est issue des Feuilles et contient des composants tels que Citral;limonène;flavonoïdes. 
    Ces composants sont reconnus pour leurs effets bénéfiques, notamment pour leurs propriétés Digestive, calmante. 
    Utilisée principalement pour traiter Digestion lente, stress, insomnie, cette tisane est particulièrement prisée dans les remèdes naturels.

    La tisane de Verveine citronnelle est idéale pour Digestion lente, stress, insomnie, offrant une solution naturelle et efficace pour améliorer la santé et le bien-être. 
    
    Précautions d'utilisation : Grossesse.
    
    En résumé, la tisane de Verveine citronnelle est idéale pour Digestion lente, stress, insomnie grâce à ses multiples bienfaits et constitue un ingrédient incontournable pour ceux qui recherchent des solutions naturelles."
78,Vigne rouge,Vitis vinifera,Europe,Feuilles,Anthocyanines;flavonoïdes;tanins,Tonique;antioxydante,Insuffisance veineuse;varices,Grossesse;allaitement,,"La tisane de Vigne rouge (Vitis vinifera) est originaire de Europe. 
    Elle est issue des Feuilles et contient des composants tels que Anthocyanines;flavonoïdes;tanins. 
    Ces composants sont reconnus pour leurs effets bénéfiques, notamment pour leurs propriétés Tonique, antioxydante. 
    Utilisée principalement pour traiter Insuffisance veineuse, varices, cette tisane est particulièrement prisée dans les remèdes naturels.

    La tisane de Vigne rouge est idéale pour Insuffisance veineuse, varices, offrant une solution naturelle et efficace pour améliorer la santé et le bien-être. 
    
    Précautions d'utilisation : Grossesse;allaitement.
    
    En résumé, la tisane de Vigne rouge est idéale pour Insuffisance veineuse, varices grâce à ses multiples bienfaits et constitue un ingrédient incontournable pour ceux qui recherchent des solutions naturelles."
79,Hamamélis,Hamamelis virginiana,Amérique du Nord,Feuilles,Flavonoïdes;Tanins;Acide gallique;Hamamélitanin;Acides phénoliques,Astringente;Vasoconstrictrice;Anti-inflammatoire,Affections du système veineux;Varices;Hémorroïdes;Congestion veineuse;Séquelles de phlébite;Métrorragies congestives;Congestions de la prostate;Diarrhées;Couperose;Inconfort occulaire;Dermatoses;Eczéma;Lésions cutanées légères;Inflammation cutanée;Inflammation des muqueuses,Enfants de moins de 12 ans,"Grossesses et allaitement sur avis médical.
En infusion: 20 grammes par litre d'eau. Laisser infuser 10 minutes. A boire dans la journée. 
En décoction (usage externe): 30 grammes de feuilles pour 1 litre d'eau. Faire bouillir 3 minutes, puis laisser infuser 10 minutes feu éteint. En applications cutanées, en compresses ou en lotion.","Découvrez les bienfaits de l’Hamamélis, une tisane nord-américaine réputée pour ses propriétés astringentes, vasoconstrictrices et anti-inflammatoires. Riche en flavonoïdes, tanins, acide gallique, hamamélitanin et acides phénoliques, cette infusion est idéale pour traiter les affections du système veineux telles que les varices, les hémorroïdes, et les congestions veineuses. Elle soulage également les séquelles de phlébite, les métrorragies congestives, les congestions de la prostate, ainsi que les diarrhées, la couperose, les inconforts oculaires, les dermatoses, l’eczéma, les lésions cutanées légères et les inflammations des muqueuses. Attention : Cette tisane est déconseillée pour les enfants de moins de 12 ans et les femmes enceintes ou allaitantes doivent la consommer uniquement sur avis médical. Préparation : En infusion, utilisez 20 grammes de feuilles par litre d'eau et laissez infuser pendant 10 minutes. A boire tout au long de la journée. Pour un usage externe, préparez une décoction avec 30 grammes de feuilles pour 1 litre d'eau, faites bouillir 3 minutes puis laissez infuser 10 minutes à feu éteint avant d'appliquer en compresses ou en lotion sur les zones à traiter."
80,Hêtre,Fagus sylvatica,Europe;Asie occidentale,Ecorce,Tanins,Antiseptique pulmonaire,Affections pulmonaires,,"En décoction: 10 grammes d'écorces pour 1/2 litre d'eau. Faire bouillir 3 minutes, puis laisser infuser 10 minutes. Boire 2 tasses par jour.","Le Hêtre est une tisane européenne et asiatique reconnue pour ses propriétés antiseptiques pulmonaires. Composée principalement de tanins, elle est idéale pour traiter les affections pulmonaires telles que la bronchite, la toux et autres infections respiratoires. Cette infusion aide à apaiser les voies respiratoires et à renforcer le système immunitaire contre les infections. Préparation : En décoction, utilisez 10 grammes d'écorces pour ½ litre d'eau. Faites bouillir pendant 3 minutes, puis laissez infuser 10 minutes avant de boire 2 tasses par jour pour bénéficier de ses vertus antiseptiques et apaisantes."
81,Houblon,Humulus lupulus,Europe;Asie tempérée;Afrique du Nord,Cônes;Feuilles,Flavonoïdes;Tanins;Sesquiterpènes;Lupulone;Humulone;Acide valérianique,Tonique de la digestion;Stimulante de la digestion;Apéritive;Fébrifuge;Diurétique;Sédative;Anxiolitique;Anaphrodisiaque,Lymphatisme;Anémie;Rachitisme;Manque d'appétit;Mauvaise assimilation;Acidité gastrique;Fièvres automnales;Vers;Elimination urinaire;Insomnie;Rhumatismes;Anxiété;Nervosité;Règles douloureuses;Migraine;Troubles nerveux;Troubles sexuels chez l'homme;Ejaculation précoce,"Grossesse;Hyperoestrogénie (fibromes, mastoses, kystes ovariens...);Antécédents, prédispositions ou cancers hormonodépendants;Consommation d'alcool;Prise d'anxiolytiques, d'antidépresseurs, de somnifères, antiépileptiques, antalgiques, antipsychotiques...;Demandez votre médecin ou pharmacien avant la prise de houblon.",En infusion: 2 à 3 grammes de cônes pour 200ml d'eau. Faire infuser 10 minutes. A boire avant le repas pour ses propriétés apéritives. A boire le soir  en cas d'insomnie ou  dans la journée en cas de nervosité/anxiété.,"Le Houblon est une tisane européenne, asiatique et nord-africaine reconnue pour ses multiples propriétés toniques, apéritives, fébrifuges, diurétiques, sédatives et anxiolytiques. Riche en flavonoïdes, tanins, sesquiterpènes, lupulone, humulone et acide valérianique, elle est idéale pour stimuler la digestion, réduire la fièvre, favoriser la lipolyse, soulager l’insomnie, les rhumatismes et l’anxiété, ainsi que pour atténuer les troubles sexuels chez l’homme tels que l’éjaculation précoce. Elle est également efficace contre le lymphatisme, l’anémie, le rachitisme, le manque d’appétit, l’acidité gastrique, les fièvres automnales, les vers, l’élimination urinaire, les migraines et les troubles nerveux. Attention : Cette tisane est contre-indiquée durant la grossesse, en cas d’hyperœstrogénie (fibromes, mastoses, kystes ovariens…), pour les personnes ayant des antécédents ou prédispositions aux cancers hormonodépendants, pour celles consommant de l’alcool ou prenant des anxiolytiques, antidépresseurs, somnifères, antiépileptiques, antalgiques, antipsychotiques… Il est recommandé de demander conseil à votre médecin ou pharmacien avant la prise de houblon. Préparation : En infusion, utilisez 2 à 3 grammes de cônes pour 200 ml d'eau et laissez infuser pendant 10 minutes. Buvez avant le repas pour ses propriétés apéritives ou le soir en cas d’insomnie et durant la journée pour soulager la nervosité et l’anxiété."
82,Jasmin,Jasminum officinale,Asie orientale,Fleurs,Acétate de linalol;Jasmone,Antispasmodique;Sédative,Tensions nerveuses;Troubles du sommeil;Toux spasmodique,Grossesse;Allaitante,En infusion: 3 grammes de fleurs pour 200ml d'eau frémissante (ne pas faire bouillir). Faire infuser 10 minutes. 2 tasses par jour dont 1 au coucher.,"Le Jasmin est une tisane asiatique prisée pour ses propriétés antispasmodiques et sédatives. Riche en acétate de linalol et en jasmone, elle est idéale pour apaiser les tensions nerveuses, favoriser un sommeil réparateur, et soulager la toux spasmodique. Cette infusion est parfaite pour réduire le stress, améliorer la qualité du sommeil et calmer les irritations des voies respiratoires. Attention : La tisane de jasmin est contre-indiquée durant la grossesse et pour les femmes allaitantes. Préparation : En infusion, utilisez 3 grammes de fleurs pour 200 ml d'eau frémissante sans faire bouillir. Laissez infuser pendant 10 minutes et buvez 2 tasses par jour, dont une au coucher pour bénéficier de ses effets calmants."
