REF,NomTisane,NomLatin,Provenance,OrganeProducteur,Sb,Properties,Indications,ContreIndications,Note,Description
38,Griffe de chat,Uncaria tomentosa,Amérique du Sud,Écorce,Alcaloïdes oxindoles pentacycliques et tétracycliques;Glucosides triterpéniques;Tanins;Flavonoïdes;Proanthocyanines,Immunostimulante;Anti-inflammatoire;Antioxydant,Arthrite;Infections;Fatigue chronique;Douleurs articulaires;Douleurs musculaires;Maladies inflammatoires chroniques,Grossesse;Allaitement;Maladies auto-immunes,En décoction (amère): Une lamelle d'écorce ou 4 cuillères à soupe pour 1 litre d'eau. Faire bouillir 30 minutes puis infuser 15 minutes feu éteint. A boire dans la journée. ,"La Griffe de chat est une tisane sud-américaine reconnue pour ses propriétés immunostimulantes, anti-inflammatoires et antioxydantes. Riche en alcaloïdes oxindoles pentacycliques et tétracycliques, glucosides triterpéniques, tanins et flavonoïdes, elle est idéale pour traiter l'arthrite, les infections, la fatigue chronique, et les douleurs articulaires et musculaires. Contre-indications : Grossesse, allaitement, maladies auto-immunes."
39,Guarana,Paullinia cupana,Amérique du Sud,Graines,Caféine;Saponines;Tanins,Stimulante;Tonique;Antidiarrhéique;Lipolyse;,Fatigue;Faiblesse;Diarrhée;Régimes amaigrissants,Hypertension;Insomnie;Anxiété;Troubles cardio-vasculaires;Ulcères gastriques;Femmes enceintes;Femmes allaitantes;Enfants;Personnes sensibles à la caféine;Les cure doivent être de très courtes durée et adaptées au cas par cas (risque de constipastion et de malabsorption des nutriments dus aux tanins),"En décoction: 1 cuillère à soupe pour 200ml d'eau. Faire bouillir pendant 3 minutes, puis infuser 10 minutes feu éteint. Boire une à deux tasses par jour, à bonne distance des repas et avant 17h.","Le Guarana est une tisane sud-américaine célèbre pour ses effets stimulants et toniques. Riche en caféine, saponines et tanins, elle est parfaite pour combattre la fatigue, favoriser la lipolyse et agir comme antidiarrhéique. Contre-indications : Hypertension, insomnie, anxiété, troubles cardio-vasculaires, ulcères gastriques, femmes enceintes et allaitantes, enfants, personnes sensibles à la caféine."
40,Gui,Viscum album,Europe,Feuilles,Lectines;Triterpènes;Stérols;Amines;Acides-phénols;Lignanes;Flavonoïdes;Glycoprotéines;Polypeptides;Viscotoxines;Alcaloïdes;Glucosides;Inosite;Saponines,Hypotensive;Régulatrice cardiaque;Immunostimulante;Anxiolytique;Sédative;Antispasmodique,Hypertension atérielle;Artériosclérose;Arythmie;Maux de tête;Angoisse;Crises nerveuses;Hyperactivité chez l'enfant;Soins pallatiatifs en cas de cancers;Maladies articulaires inflammatoires dégénératives;Goutte,"Grossesse;Allaitement;Enfants de moins de 3 ans; Il ne faut pas dépasser les doses prescrites, et toujours sous contrôle médical!","Les baies de gui sont toxiques pour l'hommes, seules les feuilles doivent être employées, sans dépasser les doses conseillées et toujours sous contrôle médical strict!
En infusion:10 grammes de feuilles pour 1/2 litre d'eau. Laisser macérer toute la nuit puis au matin porter à ébulition et couper le feu. 2 à 3 tasses par jour.
En cataplasme de feuilles contre les douleurs de goutte ou de sciatique.","Le Gui est une tisane européenne reconnue pour ses propriétés hypotensives, régulatrices cardiaques et immunostimulantes. Riche en lectines, triterpènes, stérols, amines, acides phénoliques, lignanes, flavonoïdes et glycoprotéines, elle agit comme anxiolytique, sédative et antispasmodique. Indications : Hypertension artérielle, artériosclérose, arythmie, maux de tête, angoisse, crises nerveuses, hyperactivité chez l'enfant, soins palliatifs en cas de cancers, maladies articulaires inflammatoires dégénératives et goutte. Contre-indications : Grossesse, allaitement, enfants de moins de 3 ans, prise d'anticoagulants, antécédents de cancers hormono-dépendants"
41,Guimauve,Althaea officinalis,Hémisphère Nord,Racine;Feuilles;Fleurs,Mucilages;Flavonoïdes;Acides phénoliques;Hydrate de carbone (racines);Pectine (racines);Asparagine (racines),Adoucissante;Emolliente;Anti-inflammatoire;Laxative douce,Maux de gorge;Toux sèche;Constipation;Inflammation des voies respiratoires;Inflammation de la vessie;Inflammation de l'intestin;Inflammation de la cavité buccale;Inflammation des muqueuses;Inflammations cutanées,Pas de contre-indication connue.,"En infusion: 4 grammes de feuilles et/ou fleurs pour 200ml d'eau frémissante. Laisser infuser 10 minutes. Prendre 3 tasses par jour.
En décoction:10 grammes de racines pour 1/2 litre d'eau. Faire bouillir 5 minutes, puis laisser infuser 10 minutes feu éteint. Prendre 3 tasses par jour.
En décoction concentrée (usage externe): 30 grammes de racines/feuilles et/ou fleurs. Faire bouillir 15 minutes. A employer pour des gargarismes, bains de bouche, lavements, compresses ou encore bains de siège. A pulvériser en spray adoucissant ou en compresses pour les peaux sèches, dartreuses, couperoses et autres affections cutanées ou des muqueuses.
","Découvrez les vertus apaisantes de la Guimauve, une tisane traditionnelle de l'hémisphère nord reconnue pour ses propriétés adoucissantes, émollientes et anti-inflammatoires. Riche en mucilages, flavonoïdes, acides phénoliques, hydrates de carbone, pectine, asparagine et autres composés bénéfiques, cette infusion est idéale pour soulager les maux de gorge, la toux sèche, et les inflammations des voies respiratoires, de la vessie, de l'intestin et des muqueuses. Elle est également efficace contre la constipation et les inflammations cutanées."
42,Hysope,Hyssopus officinalis,Méditerranée,Feuilles;Fleurs,Flavonoïdes;Marrubiine;Pinocamphone;Isopinocamphone,Expectorante;Antibactérienne;Digestive,Toux;Infections respiratoires;Affections des bronches;Asthme;Affections de la gorge;Ecchymoses;Entorses,"Grossesse;Epilepsie;Personnes nerveuses, à doses réduites","En infusion:3 à 4 grammes de feuilles et sommités fleuries pour 200ml d'eau. Faire infuser 10 minutes. 2 à 3 tasses par jour.
En décoction concentrée (usage externe): 20 grammes de feuilles et sommités fleuries pour 1/2 litre d'eau. Faire bouillir 2 minutes, puis laisser infuser 10 minutes feu éteint. A employer en gargarisme pour les affections de la gorge ou en compresses pour les ecchymoses ou entorses.","L'Hysope est une tisane méditerranéenne prisée pour ses propriétés expectorantes, antibactériennes et digestives. Riche en flavonoïdes, marrubiine, pinocamphone et isopinocamphone, elle est idéale pour traiter la toux, les infections respiratoires, les affections des bronches, l'asthme et les inflammations de la gorge. Elle est également bénéfique pour soulager les ecchymoses et les entorses grâce à ses effets anti-inflammatoires."
43,Lapacho,Tabebuia impetiginosa,Amérique du Sud,Écorce,Naphthoquinones;Lapachonone;Bêta-lapachone,Antibactérienne;Anti-inflammatoire;Tonique,Infections virales;Infections bactériennes;Affections ORL,Période d'opération;Prise d'anticoagulants;Maladies auto-immunes,"En décoction: 4 cuillères à soupe d'écorce pour 1 litre d'eau. Faire bouillir 5 minutes, puis laisser infuser 15 minutes feu éteint. Prendre 3 à 4 tasses par jour, en dehors des repas et avant 17h en raison de son effet tonique.","Le Lapacho est une tisane sud-américaine réputée pour ses propriétés antibactériennes, anti-inflammatoires et toniques. Riche en naphthoquinones, lapachonone et bêta-lapachone, elle est idéale pour combattre les infections virales et bactériennes, ainsi que les affections ORL (oto-rhino-laryngologiques). Cette infusion soutient également le système immunitaire et favorise la récupération en renforçant l'organisme."
44,Lavande,Lavandula angustifolia,Méditerranée,Fleurs,Linalol;Acétate de linalyle,Sédative;Calmante;Digestive;Antispasmodique;Antiseptique;Diurétique;Sudorifique,Anxiété;Insomnie;Irritabilité;Dépression légère;Maux de tête;Coliques;Flatulences;Ballonements;Toux quinteuses;Affections des bronches;Rhumatismes,,"En infusion: 3 grammes de fleurs pour 200ml d'eau frémissante. Laisser infuser 10 minutes. Prendre 3 ou 4 tasses par jour en dehors des repas.
Cette même infusion peut servir en inhalation contre les affections des bronches et du larynx, en compresses sur les coupures et les contusions, ou en bain calmant pour les enfants.
","La Lavande est une tisane méditerranéenne appréciée pour ses propriétés sédatives, calmantes et digestives. Riche en linalol et acétate de linalyle, elle aide à réduire l'anxiété, l'insomnie, l'irritabilité et les symptômes de la dépression légère. Elle est également efficace contre les maux de tête, les coliques, les flatulences, les ballonnements, les toux quinteuses et les affections des bronches. Ses propriétés antiseptiques en font un allié pour traiter les affections cutanées telles que les contusions."
45,Lierre terrestre,Glechoma hederacea,Hémisphère Nord,Feuilles,Flavonoïdes;Sesquiterpènes;Acide ursolique;Marrubiine;Tanins,Expectorante;Digestive;Stimulant des bronches,"Toux grasse;Digestion lente;Acidité gastrique;Irritation des muqueuses dues à la bronchite chronique, la grippe et l'asthme;Sinusite","Grossesse;Prise d'anticoagulants (avis médical);La prise prolongée peut provoquer des diarrhées, notamment chez les personnes sensibles","En infusion: 3 grammes de feuilles séchées pour 200ml d'eau bouillante. Laisser infuser 10 minutes. 2 à 3 tasses par jour, entre les repas.","Le Lierre terrestre, répandue dans l'Hémisphère Nord, est une plante reconnue pour ses propriétés expectorantes, digestives et stimulantes des bronches. Riche en flavonoïdes, sesquiterpènes, acide ursolique, marrubiine et tanins, elle est idéale pour traiter la toux grasse, la digestion lente, l'acidité gastrique et les irritations des muqueuses dues à la bronchite chronique, la grippe et l'asthme. Elle aide également à soulager la sinusite grâce à ses effets anti-inflammatoires."
46,Maté,Ilex paraguariensis,Amérique du Sud,Feuilles,Caféine;théobromine;flavonoïdes,Stimulante;diurétique,Fatigue;faiblesse,Hypertension;insomnie,,"La tisane de Maté (Ilex paraguariensis) est originaire de Amérique du Sud. 
    Elle est issue des Feuilles et contient des composants tels que Caféine;théobromine;flavonoïdes. 
    Ces composants sont reconnus pour leurs effets bénéfiques, notamment pour leurs propriétés Stimulante, diurétique. 
    Utilisée principalement pour traiter Fatigue, faiblesse, cette tisane est particulièrement prisée dans les remèdes naturels.

    La tisane de Maté est idéale pour Fatigue, faiblesse, offrant une solution naturelle et efficace pour améliorer la santé et le bien-être. 
    
    Précautions d'utilisation : Hypertension;insomnie.
    
    En résumé, la tisane de Maté est idéale pour Fatigue, faiblesse grâce à ses multiples bienfaits et constitue un ingrédient incontournable pour ceux qui recherchent des solutions naturelles."
47,Mauve,Malva sylvestris,Europe,Fleurs;Feuilles,Mucilages;flavonoïdes;tanins,Adoucissante;anti-inflammatoire,Toux sèche;irritation de la gorge,Aucune connue,,"La tisane de Mauve (Malva sylvestris) est originaire de Europe. 
    Elle est issue des Fleurs;Feuilles et contient des composants tels que Mucilages;flavonoïdes;tanins. 
    Ces composants sont reconnus pour leurs effets bénéfiques, notamment pour leurs propriétés Adoucissante, anti-inflammatoire. 
    Utilisée principalement pour traiter Toux sèche, irritation de la gorge, cette tisane est particulièrement prisée dans les remèdes naturels.

    La tisane de Mauve est idéale pour Toux sèche, irritation de la gorge, offrant une solution naturelle et efficace pour améliorer la santé et le bien-être. 
    
    Précautions d'utilisation : Aucune connue.
    
    En résumé, la tisane de Mauve est idéale pour Toux sèche, irritation de la gorge grâce à ses multiples bienfaits et constitue un ingrédient incontournable pour ceux qui recherchent des solutions naturelles."
48,Mélisse,Melissa officinalis,Europe,Feuilles,Acide rosmarinique;citral;linalol,Antispasmodique;calmante,Anxiété;troubles digestifs;insomnie,Hypothyroïdie,,"La tisane de Mélisse (Melissa officinalis) est originaire de Europe. 
    Elle est issue des Feuilles et contient des composants tels que Acide rosmarinique;citral;linalol. 
    Ces composants sont reconnus pour leurs effets bénéfiques, notamment pour leurs propriétés Antispasmodique, calmante. 
    Utilisée principalement pour traiter Anxiété, troubles digestifs, insomnie, cette tisane est particulièrement prisée dans les remèdes naturels.

    La tisane de Mélisse est idéale pour Anxiété, troubles digestifs, insomnie, offrant une solution naturelle et efficace pour améliorer la santé et le bien-être. 
    
    Précautions d'utilisation : Hypothyroïdie.
    
    En résumé, la tisane de Mélisse est idéale pour Anxiété, troubles digestifs, insomnie grâce à ses multiples bienfaits et constitue un ingrédient incontournable pour ceux qui recherchent des solutions naturelles."
49,Menthe poivrée,Mentha piperita,Moyen-Orient,Feuilles,Menthol;menthone;acides phénoliques,Stimulante;digestive;antiseptique,Maux de tête;troubles digestifs,Reflux gastro-œsophagien;allaitement,,"La tisane de Menthe poivrée (Mentha piperita) est originaire de Moyen-Orient. 
    Elle est issue des Feuilles et contient des composants tels que Menthol;menthone;acides phénoliques. 
    Ces composants sont reconnus pour leurs effets bénéfiques, notamment pour leurs propriétés Stimulante, digestive, antiseptique. 
    Utilisée principalement pour traiter Maux de tête, troubles digestifs, cette tisane est particulièrement prisée dans les remèdes naturels.

    La tisane de Menthe poivrée est idéale pour Maux de tête, troubles digestifs, offrant une solution naturelle et efficace pour améliorer la santé et le bien-être. 
    
    Précautions d'utilisation : Reflux gastro-œsophagien;allaitement.
    
    En résumé, la tisane de Menthe poivrée est idéale pour Maux de tête, troubles digestifs grâce à ses multiples bienfaits et constitue un ingrédient incontournable pour ceux qui recherchent des solutions naturelles."
50,Menthe pouliot,Mentha pulegium,Europe,Feuilles,Menthol;flavonoïdes;acides phénoliques,Digestive;antispasmodique,Digestion difficile;ballonnements,Grossesse;allaitement,,"La tisane de Menthe pouliot (Mentha pulegium) est originaire de Europe. 
    Elle est issue des Feuilles et contient des composants tels que Menthol;flavonoïdes;acides phénoliques. 
    Ces composants sont reconnus pour leurs effets bénéfiques, notamment pour leurs propriétés Digestive, antispasmodique. 
    Utilisée principalement pour traiter Digestion difficile, ballonnements, cette tisane est particulièrement prisée dans les remèdes naturels.

    La tisane de Menthe pouliot est idéale pour Digestion difficile, ballonnements, offrant une solution naturelle et efficace pour améliorer la santé et le bien-être. 
    
    Précautions d'utilisation : Grossesse;allaitement.
    
    En résumé, la tisane de Menthe pouliot est idéale pour Digestion difficile, ballonnements grâce à ses multiples bienfaits et constitue un ingrédient incontournable pour ceux qui recherchent des solutions naturelles."
51,Millepertuis,Hypericum perforatum,Europe,Fleurs,Hypericine;flavonoïdes;tanins,Antidépresseur;calmante,Dépression légère;anxiété,Grossesse;allaitement;interactions médicamenteuses,,"La tisane de Millepertuis (Hypericum perforatum) est originaire de Europe. 
    Elle est issue des Fleurs et contient des composants tels que Hypericine;flavonoïdes;tanins. 
    Ces composants sont reconnus pour leurs effets bénéfiques, notamment pour leurs propriétés Antidépresseur, calmante. 
    Utilisée principalement pour traiter Dépression légère, anxiété, cette tisane est particulièrement prisée dans les remèdes naturels.

    La tisane de Millepertuis est idéale pour Dépression légère, anxiété, offrant une solution naturelle et efficace pour améliorer la santé et le bien-être. 
    
    Précautions d'utilisation : Grossesse;allaitement;interactions médicamenteuses.
    
    En résumé, la tisane de Millepertuis est idéale pour Dépression légère, anxiété grâce à ses multiples bienfaits et constitue un ingrédient incontournable pour ceux qui recherchent des solutions naturelles."
52,Oranger,Citrus aurantium,Méditerranée,Fleurs,Flavonoïdes;linalol;limonène,Sédative;digestive,Anxiété;troubles du sommeil;digestion difficile,Allergies aux agrumes,,"La tisane de Oranger (Citrus aurantium) est originaire de Méditerranée. 
    Elle est issue des Fleurs et contient des composants tels que Flavonoïdes;linalol;limonène. 
    Ces composants sont reconnus pour leurs effets bénéfiques, notamment pour leurs propriétés Sédative, digestive. 
    Utilisée principalement pour traiter Anxiété, troubles du sommeil, digestion difficile, cette tisane est particulièrement prisée dans les remèdes naturels.

    La tisane de Oranger est idéale pour Anxiété, troubles du sommeil, digestion difficile, offrant une solution naturelle et efficace pour améliorer la santé et le bien-être. 
    
    Précautions d'utilisation : Allergies aux agrumes.
    
    En résumé, la tisane de Oranger est idéale pour Anxiété, troubles du sommeil, digestion difficile grâce à ses multiples bienfaits et constitue un ingrédient incontournable pour ceux qui recherchent des solutions naturelles."
53,Origan,Origanum vulgare,Méditerranée,Feuilles,Carvacrol;thymol;flavonoïdes,Antibactérienne;digestive,Infections respiratoires;digestion difficile,Grossesse,,"La tisane de Origan (Origanum vulgare) est originaire de Méditerranée. 
    Elle est issue des Feuilles et contient des composants tels que Carvacrol;thymol;flavonoïdes. 
    Ces composants sont reconnus pour leurs effets bénéfiques, notamment pour leurs propriétés Antibactérienne, digestive. 
    Utilisée principalement pour traiter Infections respiratoires, digestion difficile, cette tisane est particulièrement prisée dans les remèdes naturels.

    La tisane de Origan est idéale pour Infections respiratoires, digestion difficile, offrant une solution naturelle et efficace pour améliorer la santé et le bien-être. 
    
    Précautions d'utilisation : Grossesse.
    
    En résumé, la tisane de Origan est idéale pour Infections respiratoires, digestion difficile grâce à ses multiples bienfaits et constitue un ingrédient incontournable pour ceux qui recherchent des solutions naturelles."
54,Ortie,Urtica dioica,Europe,Feuilles,Flavonoïdes;acides aminés;minéraux,Revitalisante;anti-inflammatoire,Fatigue;anémie;douleurs articulaires,Grossesse;insuffisance rénale,,"La tisane de Ortie (Urtica dioica) est originaire de Europe. 
    Elle est issue des Feuilles et contient des composants tels que Flavonoïdes;acides aminés;minéraux. 
    Ces composants sont reconnus pour leurs effets bénéfiques, notamment pour leurs propriétés Revitalisante, anti-inflammatoire. 
    Utilisée principalement pour traiter Fatigue, anémie, douleurs articulaires, cette tisane est particulièrement prisée dans les remèdes naturels.

    La tisane de Ortie est idéale pour Fatigue, anémie, douleurs articulaires, offrant une solution naturelle et efficace pour améliorer la santé et le bien-être. 
    
    Précautions d'utilisation : Grossesse;insuffisance rénale.
    
    En résumé, la tisane de Ortie est idéale pour Fatigue, anémie, douleurs articulaires grâce à ses multiples bienfaits et constitue un ingrédient incontournable pour ceux qui recherchent des solutions naturelles."
55,Passiflore,Passiflora incarnata,Amérique du Nord,Fleurs,Flavonoïdes;alkaloïdes;glycosides,Sédative;antispasmodique,Insomnie;anxiété;nervosité,Grossesse;allaitement,,"La tisane de Passiflore (Passiflora incarnata) est originaire de Amérique du Nord. 
    Elle est issue des Fleurs et contient des composants tels que Flavonoïdes;alkaloïdes;glycosides. 
    Ces composants sont reconnus pour leurs effets bénéfiques, notamment pour leurs propriétés Sédative, antispasmodique. 
    Utilisée principalement pour traiter Insomnie, anxiété, nervosité, cette tisane est particulièrement prisée dans les remèdes naturels.

    La tisane de Passiflore est idéale pour Insomnie, anxiété, nervosité, offrant une solution naturelle et efficace pour améliorer la santé et le bien-être. 
    
    Précautions d'utilisation : Grossesse;allaitement.
    
    En résumé, la tisane de Passiflore est idéale pour Insomnie, anxiété, nervosité grâce à ses multiples bienfaits et constitue un ingrédient incontournable pour ceux qui recherchent des solutions naturelles."
56,Plantain,Plantago lanceolata,Europe,Feuilles,Mucilages;flavonoïdes;acides phénoliques,Anti-inflammatoire;astringente,Toux;inflammations des voies respiratoires,Aucune connue,,"La tisane de Plantain (Plantago lanceolata) est originaire de Europe. 
    Elle est issue des Feuilles et contient des composants tels que Mucilages;flavonoïdes;acides phénoliques. 
    Ces composants sont reconnus pour leurs effets bénéfiques, notamment pour leurs propriétés Anti-inflammatoire, astringente. 
    Utilisée principalement pour traiter Toux, inflammations des voies respiratoires, cette tisane est particulièrement prisée dans les remèdes naturels.

    La tisane de Plantain est idéale pour Toux, inflammations des voies respiratoires, offrant une solution naturelle et efficace pour améliorer la santé et le bien-être. 
    
    Précautions d'utilisation : Aucune connue.
    
    En résumé, la tisane de Plantain est idéale pour Toux, inflammations des voies respiratoires grâce à ses multiples bienfaits et constitue un ingrédient incontournable pour ceux qui recherchent des solutions naturelles."
57,Prêle,Equisetum arvense,Europe,Tige,Silice;flavonoïdes;saponines,Diurétique;reminéralisante,Rétention d'eau;fatigue;fragilité osseuse,Insuffisance rénale,,"La tisane de Prêle (Equisetum arvense) est originaire de Europe. 
    Elle est issue des Tige et contient des composants tels que Silice;flavonoïdes;saponines. 
    Ces composants sont reconnus pour leurs effets bénéfiques, notamment pour leurs propriétés Diurétique, reminéralisante. 
    Utilisée principalement pour traiter Rétention d'eau, fatigue, fragilité osseuse, cette tisane est particulièrement prisée dans les remèdes naturels.

    La tisane de Prêle est idéale pour Rétention d'eau, fatigue, fragilité osseuse, offrant une solution naturelle et efficace pour améliorer la santé et le bien-être. 
    
    Précautions d'utilisation : Insuffisance rénale.
    
    En résumé, la tisane de Prêle est idéale pour Rétention d'eau, fatigue, fragilité osseuse grâce à ses multiples bienfaits et constitue un ingrédient incontournable pour ceux qui recherchent des solutions naturelles."
58,Prunellier,Prunus spinosa,Europe,Fleurs;Fruits,Flavonoïdes;tanins;acides phénoliques,Astringente;digestive,Diarrhée;troubles digestifs,Aucune connue,,"La tisane de Prunellier (Prunus spinosa) est originaire de Europe. 
    Elle est issue des Fleurs;Fruits et contient des composants tels que Flavonoïdes;tanins;acides phénoliques. 
    Ces composants sont reconnus pour leurs effets bénéfiques, notamment pour leurs propriétés Astringente, digestive. 
    Utilisée principalement pour traiter Diarrhée, troubles digestifs, cette tisane est particulièrement prisée dans les remèdes naturels.

    La tisane de Prunellier est idéale pour Diarrhée, troubles digestifs, offrant une solution naturelle et efficace pour améliorer la santé et le bien-être. 
    
    Précautions d'utilisation : Aucune connue.
    
    En résumé, la tisane de Prunellier est idéale pour Diarrhée, troubles digestifs grâce à ses multiples bienfaits et constitue un ingrédient incontournable pour ceux qui recherchent des solutions naturelles."
59,Réglisse,Glycyrrhiza glabra,Asie;Méditerranée,Racine,Glycyrrhizine;flavonoïdes;saponines,Anti-inflammatoire;antitussif,Maux de gorge;toux,Hypertension;grossesse,,"La tisane de Réglisse (Glycyrrhiza glabra) est originaire de Asie;Méditerranée. 
    Elle est issue des Racine et contient des composants tels que Glycyrrhizine;flavonoïdes;saponines. 
    Ces composants sont reconnus pour leurs effets bénéfiques, notamment pour leurs propriétés Anti-inflammatoire, antitussif. 
    Utilisée principalement pour traiter Maux de gorge, toux, cette tisane est particulièrement prisée dans les remèdes naturels.

    La tisane de Réglisse est idéale pour Maux de gorge, toux, offrant une solution naturelle et efficace pour améliorer la santé et le bien-être. 
    
    Précautions d'utilisation : Hypertension;grossesse.
    
    En résumé, la tisane de Réglisse est idéale pour Maux de gorge, toux grâce à ses multiples bienfaits et constitue un ingrédient incontournable pour ceux qui recherchent des solutions naturelles."
